title,infoMr.Tickle,Mr.Tickle's story stops and really begins with him in bed and making himself breakfast without getting up because of his extraordinarily long armsMr.Greedy,The story begins with Mr. Greedy waking up and having his overly large daily breakfastMr.Topsy-Turvy,Mr.Topsy-Turvy does everything the wrong way. One day he comes to the town where the reader lives"Little Miss Bossy,Little Miss Bossy is very bossy (hence her name) and she is as rude as Mr UppityMr.Uppity,Mr.Uppity lives in Bigtown and he is very rich. He is rude to everybody (they call him Miserable old Uppity) until one day he meets a goblin